{
  "schema_version": 1,
  "domains": ["mathematics", "statistics", "physics", "engineering"],
  "workflows": ["full-research-cycle", "prepare-publication"],
  "materials": ["papers", "pdf", "tables", "datasets"],
  "stages": ["active-research", "writing"],
  "methods": ["code", "formulas", "mathematical-models"],
  "specialization": "quantitative research",
  "locale": "en"
}
